stt,khudl,tinhthanh,dateTimeValue,linkanh,mota
767,Tình Khau Khang & vườn Mận,"Tỉnh/thành phố: Ngân Sơn, Bắc Kạn",03/03/2024 03:09:15 PM,https://image.baobackan.com.vn/w800/Uploaded/2024/dbkxqxdllu/2023_04_24/na-na-9985.jpg,"Đến Ngân Sơn du lịch mà chưa ghé Tình Khau Khang để ngắm hoa mận nở rộ thì sẽ vô cùng tiếc nuối! Tại điểm du lịch Tình Khau Khang bạn không chỉ có dịp ngắm vườn mận trổ hoa trắng xóa, đẹp đến nao lòng, trải nghiệm nhiều đặc sản hấp dẫn mà còn có thể ngày ngày chìm đắm trong không khí lành của thiên nhiên bao la nữa đấy. Đây là địa điểm có view ngắm toàn cảnh thị trấn Vân Tùng, được thiết kế theo phong cách sân vườn với không gian mở rộng rãi, kết hợp hài hòa giữa truyền thống và hiện đại, có chòi che mái cọ, cỏ cây xanh mướt và những bồn hoa rực rỡ. Không gian càng trở nên lãng mạn và nên thơ hơn những lúc hoàng hôn và khi thị trấn lên đèn. Du khách sẽ được thưởng thức ẩm thực địa phương với những món ăn đa dạng, phong phú như gà ta rang muối cùng các món gà nướng, nộm, luộc, ăn kèm rau xanh, khẩu nua lếch nhiều màu... Du khách còn được nhâm nhi ly rượu ngô, men lá đựng trong ống trúc và tận hưởng những giây phút bình yên, thư thái của cuộc sống. Mặc dù mới đi vào hoạt động từ đầu năm 2023 nhưng mô hình du lịch cộng đồng của 3 bạn trẻ đã đón số lượng khách tương đối lớn. Ngoài phục vụ đạo cụ chụp hình như trang phục dân tộc, khăn, ô..., du khách còn được phục vụ bữa ăn nấu theo kiểu truyền thống của địa phương; được giới thiệu về bản sắc của đồng bào dân tộc Tày nơi đây, được tuyên truyền về lối sống xanh, ý thức bảo vệ môi trường... Trong tương lai, những bạn trẻ này mong muốn xây dựng những đội văn nghệ thôn, bản phục vụ du khách, homestay lưu trú và liên kết với các địa điểm nổi tiếng của huyện Ngân Sơn tạo thành tour du lịch. Địa chỉ: Ngân Sơn, Bắc Kạn (miền Bắc, Việt Nam) Phân loại du lịch: du lịch nông thôn, du lịch kết hợp"
1838,Thành Cổ Luy Lâu Bắc Ninh,Tỉnh/thành phố: Bắc Ninh,03/03/2024 03:09:01 PM,"https://ik.imagekit.io/tvlk/blog/2023/06/thanh-co-luy-lau-6.jpg?tr=dpr-2,w-675","Thành cổ Luy Lâu, từng là một thành cổ nổi tiếng phồn hoa, đô hội của xứ Giao Chỉ xưa. Đây được xem là một địa điểm du lịch lịch sử khá nổi tiếng tại bắc ninh Thành cổ Luy Lâu còn được biết đến với một số tên gọi khác như Siêu Loại, Lũng Khê,... Địa điểm này tọa lạc tại xã Thanh Khương, Thuận Thành, Bắc Ninh (miền Bắc, Việt Nam). Luy Lâu có niên đại khoảng 2000 năm (thời Đông Hán), là một trong những tòa thành cổ nhất Việt Nam, chỉ sau Cổ Loa. Nơi đây được coi là kinh đô thứ 2 của Việt Nam và là trung tâm văn hóa giáo dục của nước ta ở thế kỷ thứ II. Thời tiết ở thành cổ cũng như ở Bắc Ninh khá ổn định, do đó bạn có thể đến đây tham quan vào bất kỳ thời điểm nào trong năm. Tuy nhiên nếu vừa muốn thăm quan Luy Lâu, vừa muốn khám phá các hoạt động văn hóa ở “miền quan họ”, du khách nên đến địa điểm trên vào tháng 1-3 hằng năm. Lúc này có rất nhiều lễ hội lớn và đặc sắc để bạn có thể khám phá, chẳng hạn như hội Lim, hội Đình Bảng… Phân loại du lịch: du lịch nông thôn, du lịch văn hóa"
1294,Hồ Hoàn Kiếm,Tỉnh/thành phố: Hà Nội,03/03/2024 03:08:58 PM,https://static.vinwonders.com/production/ho-hoan-kiem-thumb.jpg,"Cách Cầu Long Biên không xa là Hồ Hoàn Kiếm, 1 biểu tượng, là biểu tượng của Hà Nội mà bất cứ du khách trong, ngoài nước nào cũng đều phải tới tham quan Nơi đây còn nổi tiếng với cảnh đẹp của đền Ngọc Sơn, cầu Thê Húc, tháp Rùa … cũng như vị ngon nổi tiếng của kem Thủy Tạ, kem Tràng Tiền. Từ cuối năm 2016, cứ mỗi dịp cuối tuần, các đường phố quanh hồ Gươm đã cấm mọi phương tiện, khiến nơi đây trở thành 1 khu phố đi bộ nhộn nhịp, đông vui nhất Việt Nam cho tới giờ Hồ Hoàn Kiếm (hay còn được gọi là Hồ Gươm) nằm ở trung tâm quận Hoàn Kiếm, thủ đô Hà Nội (miền Bắc, Việt Nam). Hồ có diện tích khoảng 12ha, bao quanh bởi 3 con phố là Lê Thái Tổ, Hàng Khay và Đinh Tiên Hoàng. Từ Hồ Gươm du khách có thể dễ dàng di chuyển tới các con phố cổ của Hà Nội như Hàng Bài, Hàng Ngang, Tràng Tiền, Tràng Thi hay các địa điểm nổi tiếng xung quanh như Nhà Thờ, Nhà Hát Lớn,... Sở hữu vị trí đắc địa như vậy, Hồ Hoàn Kiếm trở thành địa điểm thu hút rất nhiều du khách trong và ngoài nước đến tham quan trong hành trình khám phá thủ đô Hà Nội. Với vẻ đẹp và lịch sử lâu đời, hồ nước ngọt này còn là cảm hứng sáng tác của biết bao nhiêu tác phẩm thơ ca nghệ thuật. Phân loại du lịch: du lịch kết hợp, du lịch đô thị"
1632,Chùa Phật Học,Tỉnh/thành phố: Cần Thơ,03/03/2024 03:08:47 PM,https://statics.vinpearl.com/chua-phat-hoc-can-tho-2_1632218069.jpg,"Là một nơi có rất nhiều các địa điểm tâm linh và nhiều ngôi chùa đẹp cổ kính, đến với các địa điểm du lịch Cần Thơ, đừng quên ghé thăm chùa Phật Học - địa điểm quen thuộc của các đoàn Phật tử và là điểm du lịch tâm linh hấp dẫn rất nhiều khách du lịch. Là địa điểm nổi tiếngn, địa chỉ ố 11 đại lộ Hòa Bình, quận Ninh Kiều, nằm ở trung tâm thành phố Cần Thơ với tấp nập xe cộ qua lại, tuy nhiên bên trong không gian chùa vẫn giữ được sự thanh tịnh và uy nghiêm. Chùa có lịch sử lâu đời được xây dựng từ những năm 1951 với lối kiến trúc tương đối đơn giản, trước đây từng là trụ sở của Hội Phật học Nam Việt tỉnh Cần Thơ. Chùa mang vẻ đẹp tâm linh, thanh tịnh. Nổi bật với 5 tầng uy quyền, thờ 3 phật nổi tiếng: Phật A Di Đà, Phật Thích Ca, Phật Dược Sư. Địa chỉ: 34 Đại lộ Hoà Bình, Tân An, Ninh Kiều, Cần Thơ, Việt Nam Phân loại du lịch: du lịch văn hóa"
56,Thiền viện Trúc Lâm Tây Thiên,Tỉnh/thành phố: Vĩnh Phúc,03/03/2024 03:08:41 PM,"https://ik.imagekit.io/tvlk/blog/2023/07/chua-tay-thien-8.jpg?tr=dpr-2,w-675","Tây Thiên Tam Đảo Vĩnh Phúc là một trong những vùng đất tâm linh nổi tiếng ở miền bắc, với hàng ngàn người tìm tới đây mỗi năm để hành hương bái Phật, cầu bình an, tài lộc cho bản thân cùng gia đình. Nếu đã đến với địa điểm du lịch Vĩnh Phúc. Thì du khách đừng nên bỏ lỡ địa điểm này nhé! Đây là một địa điểm rất đáng để đi đấy. Địa chỉ: thị trấn Đại Đình, huyện Tam Đảo, tỉnh Vĩnh Phúc (đồng bằng sông Hồng, miền Bắc Việt Nam) Phân loại du lịch: Du lịch văn hóa"
982,Nhà thờ Con Gà,Tỉnh/thành phố: Lâm Đồng,03/03/2024 03:02:06 PM,https://images.foody.vn/res/g14/135812/prof/s/foody-mobile-2654545845845-jpg-710-636069390129441826.jpg,"Nhà thờ Con Gà được rất nhiều du khách trong và ngoài nước yêu mến bởi kiến trúc xây dựng đặc trưng có từ thời Pháp. Tọa lạc tại số 15 đường Trần Phú, phương 3, thành phố Đà Lạt, nơi đây không chỉ là công trình tôn giáo đóng vai trò quan trọng trong đời sống văn hóa tinh thần của người dân trong khu vực mà còn là địa điểm tham quan với hàng triệu lượt khách ghé thăm mỗi năm. Sở dĩ nhà thờ được gọi như vậy là bởi ở trên ngọn tháp chuông của nhà thờ có gắn một con gà bằng đồng. Để hoàn thiện được kiến trúc này, các công nhân và kỹ sư phải ngày đêm làm việc liên tục trong vòng 11 năm. Kiến trúc tổng thể của địa điểm này đều tuân theo quy luật đối xứng, tạo nên vẻ đẹp độc đáo. Hãy ghé thăm địa điểm du lịch tại Lâm Đồng này nhé! số 15 Đường Trần Phú, Phường 3, thành phố Đà Lạt, tỉnh Lâm Đồng Phân loại du lịch: du lịch văn hóa"
989,Vườn dâu tây Biofresh,Tỉnh/thành phố: Lâm Đồng,03/03/2024 03:02:04 PM,https://static.vinwonders.com/production/ho-than-tho-da-lat-0.jpg,"Nằm trong khu du lịch hồ Than Thở, với diện tích đất trồng khoảng 3ha. Vườn dâu tây Biofresh là nông trại trồng dâu rất nổi tiếng tại Đà Lạt. Dâu ở đây được trồng theo phương pháp thủy canh và chăm sóc theo tiêu chuẩn châu Âu. Cho nên mỗi quả dâu đều căng mọng đỏ tươi. Đến đây tham quan, du khách đều có thể thưởng thức dâu tại chỗ. Ngoài ra, có thể mua dâu làm quà tặng người thân, bạn bè nữa đấy. Địa chỉ: khu du lịch hồ Than Thở, Hồ Xuân Hương, phường 10, thành phố Đà Lạt, tỉnh Lâm Đồng Phân loại du lịch: du lịch sinh thái"
693,Khu du lịch Tam Cốc - Bích Động,Tỉnh/thành phố: Ninh Bình,02/24/2024 09:40:52 PM,https://static-images.vnncdn.net/files/publish/2023/7/8/ninh-binh-anh-so-du-lich-cc-1021-864.jpeg,"Khu du lịch Tam Cốc – Bích Động được ví như ""vịnh Hạ Long cạn"" với nhiều cảnh đẹp như Tam Cốc, đền Thái Vi, chùa Bích Động, động Tiên, hang Bụt, thung Nắng, thung Nham, vườn chim... Nổi tiếng với danh xưng ‘Nam thiên đệ nhị động’, Tam Cốc Bích Động sở hữu cảnh sắc làng quê yên bình cùng hệ thống hang động núi đá vôi ấn tượng. Là một phần trong Quần thể danh thắng Tràng An, Tam Cốc Bích Động là điểm đến hoàn hảo dành cho những ai muốn khám phá trọn vẹn vẻ đẹp non sông. Địa chỉ: Ninh Hải, Hoa Lư, Ninh Bình (đồng bằng sông Hồng, miền Bắc Việt Nam) Phân loại du lịch: du lịch sinh thái, du lịch văn hóa, du lịch nghỉ dưỡng và du lịch khám phá"
670,Núi Non Nước,Tỉnh/thành phố: Ninh Bình,02/24/2024 08:06:29 PM,https://postumtravel.vn/wp-content/uploads/2022/07/nui-non-nuoc-2.jpg,"Núi Non Nước (tên cổ là Dục Thúy Sơn), là một ngọn núi nằm ngay trên ngã ba sông Vân với sông Đáy, kẹp giữa 2 cây cầu Non Nước và cầu Ninh Bình. Núi là một tiền đồn nằm ở cửa ngõ phía đông thành phố Ninh Bình. Lối lên đỉnh Non Nước qua 72 bậc gạch đá, chia làm 5 cấp. Đỉnh núi tương đối bằng phẳng, cây cối xanh mát, rất thuận tiện nghỉ ngơi, giải trí cho khách tham quan. Địa chỉ: phía đông Bắc thành phố Ninh Bình trên địa bàn Đinh Tiên Hoàng phường Thanh Bình, thành phố Ninh Bình (đồng bằng sông Hồng, miền Bắc Việt Nam) Phân loại du lịch: Du lịch sinh thái"
670,Núi Non Nước,Tỉnh/thành phố: Ninh Bình,02/24/2024 08:06:17 PM,https://postumtravel.vn/wp-content/uploads/2022/07/nui-non-nuoc-2.jpg,"Núi Non Nước (tên cổ là Dục Thúy Sơn), là một ngọn núi nằm ngay trên ngã ba sông Vân với sông Đáy, kẹp giữa 2 cây cầu Non Nước và cầu Ninh Bình. Núi là một tiền đồn nằm ở cửa ngõ phía đông thành phố Ninh Bình. Lối lên đỉnh Non Nước qua 72 bậc gạch đá, chia làm 5 cấp. Đỉnh núi tương đối bằng phẳng, cây cối xanh mát, rất thuận tiện nghỉ ngơi, giải trí cho khách tham quan. Địa chỉ: phía đông Bắc thành phố Ninh Bình trên địa bàn Đinh Tiên Hoàng phường Thanh Bình, thành phố Ninh Bình (đồng bằng sông Hồng, miền Bắc Việt Nam) Phân loại du lịch: Du lịch sinh thái"
713,Đền thờ Trương Hán Siêu,Tỉnh/thành phố: Ninh Bình,02/24/2024 07:59:28 PM,https://mia.vn/media/uploads/blog-du-lich/den-tho-truong-han-sieu-noi-tu-hao-truyen-thong-dan-toc-o-xu-ninh-binh-1640201894.jpg,"Đền thờ Trương Hán Siêu nằm ở chân núi Non Nước thuộc công viên Dục Thúy Sơn, nằm bên sông Đáy ở thành phố Ninh Bình. Đền thờ Trương Hán Siêu và núi Non Nước hợp lại tạo thành một khu văn hóa, tâm linh giữa thành phố Ninh Bình. Địa chỉ: Cầu Non Nước, Vân Gia, Ninh Bình (đồng bằng sông Hồng, miền Bắc Việt Nam) Phân loại du lịch: Du lịch văn hóa"
