stt,khudl,tinhthanh,dateTimeValue,linkanh,mota
965,Bảo tàng thiên nhiên Tây Nguyên,Tỉnh/thành phố: Lâm Đồng,03/06/2024 04:46:41 PM,https://statics.vinpearl.com/Bao-tang-Lam-Dong_1690008310.jpg,"Gọi là bảo tàng hẳn nơi này đa phần chứa đựng những vật thể quý hiếm. Thật vậy, ở đây vẫn đang lưu trữ hàng loạt hiện vật gồm các loài thực vật: thông hai lá dẹt, thông 5 lá, thủy tùng. Đặc biệt có các loại lan và cây cảnh vô cùng đặc sắc, quý hiếm mà bạn khó có thể tìm được. Còn có rất nhiều loài động vật được lưu giữ điển hình như: gấu ngựa, cầy vằn bắc, mèo gấm, beo lửa,… Khu bảo tàng này được thành lập mang trong mình thông điệp có ý nghĩa vô cùng nhân văn: ”Hãy thân thiện hơn với thiên nhiên, để thiên nhiên mãi là bạn đồng hành của con người” Địa chỉ: 116 Xô Viết Nghệ Tĩnh, phường 7, Thành phố Đà Lạt, Lâm Đồng Phân loại du lịch: du lịch văn hóa"
819,Khu bảo tồn thiên nhiên Mường Nhé-Điện Biên,"Tỉnh/thành phố: Mường Nhé, Điện Biên",03/06/2024 04:46:32 PM,https://btnmt.1cdn.vn/2023/02/07/11-1-.jpg,"Khu bảo tồn thiên nhiên Mường Nhé là một trong những khu rừng đặc dụng lớn nhất Việt Nam với hệ sinh thái vô cùng đa dạng. Nơi đây có tuyến đường nối với A Pa Chải và trung tâm huyện Mường Nhé. Hệ sinh thái rừng ở Khu BTTN Mường Nhé nằm trong thảm thực vật nhiệt đới, á nhiệt đới với 742 loài thực vật. Trong đó, có 27 loài thực vật như: Pơ mu, dổi, trầm hương, lát hoa... và 67 loài động vật như: Gấu ngựa, nai, linh trưởng, voọc xám, tê tê, công… nằm trong Sách đỏ Việt Nam. Kết quả nghiên cứu sơ bộ về các loài thú nhỏ và lưỡng cư ghi nhận thêm 10 loài thú nhỏ, 11 loài bò sát và 17 loài lưỡng cư trong Khu BTTN Mường Nhé. Địa chỉ: huyện Mường Nhé, tỉnh Điện Biên (miền Bắc, Việt Nam) Phân loại du lịch: du lịch sinh thái, du lịch khám phá"
1741,Vườn Quốc Gia Cát Tiên Bình Phước,"Tỉnh/thành phố: Bù Đăng và Đồng Phú, Bình Phước",03/06/2024 04:46:29 PM,https://mia.vn/media/uploads/blog-du-lich/den-vuon-quoc-gia-cat-tien-tay-cat-tien-kham-pha-thien-nhien-ky-thu-02-1656498315.jpeg,"Ở đây có một hệ rừng sinh thái vô cùng đa dạng và phong phú, đây cũng là nơi bảo tồn các loài động thực vật quý hiếm. Tê giác rừng là động vật quý hiếm của Việt Nam và cũng chỉ sinh sống ở nơi đây. Địa hình của khu vườn này là sự kết hợp xen kẽ các thác ghềnh, đầm suối, các vùng ngập nước tạo nên một khung cảnh tuyệt đẹp. Khi đến đây du khách không chỉ được thoải mái ngắm nhìn hệ sinh thái đa dạng, các loài động thực vật mới lạ. Đặc biệt, vườn quốc gia Cát Tiên có rất nhiều loại động vật, chim nằm trong sách đỏ và được bảo vệ nghiêm ngặt. Chính vì vậy, đây sẽ là lựa chọn phù hợp với những người muốn gần gũi thiên nhiên, khám phá thế giới các loài sinh vật. Trong quá trình di chuyển bạn còn được hòa mình với thiên nhiên cảm nhận bầu không khí trong lành, khác biệt hoàn toàn sự đông đúc, tấp nập của thành thị. Địa chỉ: Nằm trên địa phận huyện Bù Đăng và Đồng Phú, tỉnh Bình Phước (miền Nam, Việt Nam)"
32,Rừng nguyên sinh Bình Châu,"Tỉnh/thành phố: Xuyên Mộc, Vũng Tàu",03/06/2024 04:46:26 PM,https://52hz.vn/wp-content/uploads/2022/11/rung-quoc-gia-binh-chau-huyen-bi.jpg,"Với cảnh quan tự nhiên hoang sơ, rừng quốc gia này là một điểm đến lý tưởng cho những ai yêu thích khám phá thiên nhiên và muốn tìm hiểu về hệ sinh thái đa dạng miền nhiệt đới. Rừng Quốc gia Bình Châu nổi tiếng với động vật và thực vật phong phú. Đây là nơi sinh sống của nhiều loài động vật quý hiếm và thực vật đặc biệt, bao gồm các loài linh trưởng, hươu, khỉ và nhiều loại cây cỏ quý hiếm. Điều này tạo nên một môi trường sống đa dạng và hấp dẫn cho các nhà nghiên cứu, nhà khoa học và du khách yêu thiên nhiên. Với vị trí thuận lợi và quy mô ấn tượng, đây là một điểm đến du lịch tự nhiên ấn tượng, nơi du khách có thể tham gia vào đa dạng các hoạt động như đi bộ, trekking, đạp xe, thám hiểm rừng và thả mình vào vẻ đẹp thanh bình của thiên nhiên. Địa chỉ: Quốc lộ 55, thuộc xã Bình Châu, huyện Xuyên Mộc, Bà Rịa - Vũng Tàu (miền Nam, Việt Nam) Phân loại du lịch: du lịch sinh thái"
859,Bãi biển Trà Cổ,"Tỉnh/thành phố: Móng Cái, Quảng Ninh",03/06/2024 04:04:27 PM,"https://ik.imagekit.io/tvlk/blog/2023/09/bien-tra-co-6.jpg?tr=dpr-2,w-675","Địa chỉ: Bãi biển Trà Cổ nằm tại phường Trà Cổ, thành phố Móng Cái, tỉnh Quảng Ninh (miền Bắc, Việt Nam). Bãi biển Trà Cổ được mệnh danh là ""Bà chúa của các bãi biển"", là một trong những điểm du lịch nổi tiếng của tỉnh Quảng Ninh. Bãi biển có bờ cát trắng mịn, nước biển trong xanh, sóng biển nhẹ nhàng, là nơi lý tưởng để tắm biển, nghỉ dưỡng, và vui chơi giải trí. Ngoài ra, Bãi biển Trà Cổ còn có nhiều tiềm năng phát triển các loại hình du lịch khác như du lịch sinh thái, du lịch văn hóa, và du lịch nghỉ dưỡng. Phân loại du lịch: Ngoài du lịch biển, Bãi biển Trà Cổ còn có nhiều tiềm năng phát triển các loại hình du lịch khác như du lịch sinh thái, du lịch văn hóa, và du lịch nghỉ dưỡng."
243,Biển Tân Thành,Tỉnh/thành phố: Tiền Giang,03/06/2024 04:04:24 PM,https://ik.imagekit.io/tvlk/blog/2022/03/bien-tan-thanh-2.jpg,"Biển Tân Thành hay còn gọi là bãi biển Gò Công nằm ở xã Tân Thành huyện Gò Công, tỉnh Tiền Giang, cách trung tâm TP Mỹ Tho 50 km, cách TP. Hồ Chí Minh khoảng 70km theo Quốc lộ 50. Bãi biển này kéo dài khoảng 7 km, sở hữu những triền cát đen trải dài thực sự ấn tượng. Nói không ngoa khi nơi đây là một trong những bãi biển cát đen thú vị nhất Việt Nam. Biển Tân Thành còn biết đến với cái tên biển Gò Công Tiền Giang. Đây là một bãi biển mang đặc trưng của phù sa và là nơi đón những khoảnh khắc đẹp và thú vị trong ngày như lúc bình minh hay hoàng hôn. Bãi biển nổi tiếng với làng nghề nuôi nghêu và các món hải sản đặc trưng. Đặc biệt, Cây cầu dài trên biển với độ dài 300m chắc chắn sẽ là nơi để bạn có thể tản mạn và đón gió biển thật trọn vẹn. Cây cầu nhỏ nằm vắt mình trên biển cũng được xem là một trong những điểm đến bình yên nhất tại nơi đây. Ở điểm du lịch Trà Vinh này các bạn có thể đón những khoảnh khắc đẹp trong ngày như lúc bình minh hay hoàng hôn. Lựa chọn du lịch biển gần Sài Gòn những ngày cuối tuần chắc chắn đây sẽ là một trong những gợi ý tương đối phù hợp. Phân loại du lịch: du lịch biển"
29,Hồ Cốc,"Tỉnh/thành phố: Xuyên Mộc, Vũng Tàu",03/06/2024 04:04:19 PM,https://cdn.vntrip.vn/cam-nang/wp-content/uploads/2017/08/bien-ho-coc-vung-tau.jpg,"Biển Hồ Cốc có diện tích khoảng 11 nghìn hecta, tùy không lớn như nhiều bãi biển khác nhưng lại sở hữu vẻ đẹp không trùng lặp với bất kỳ bãi biển nào. Mùa du lịch cao điểm nhất của Hồ Cốc là tháng 4 đến tháng 8 hằng năm. Nếu bạn muốn có một không gian yên tĩnh để tận hưởng cảnh sắc thiên nhiên biển cả, bạn có thể đến Hồ Cốc vào tháng 12 năm nay đến tháng 4 năm sau, tuy khí hậu không được đẹp như tháng 4-8 nhưng cũng đủ ôn hòa để bạn có thể chiêm ngưỡng và cảm thụ không khí biển thanh bình. Đây là một trong những lý do vì sao bạn cần đến Hồ Cốc vào những ngày thời tiết ôn hòa đấy. Với cảnh biển hoang sơ chưa từng có sự tác động của con người, cùng không khí trong lành và bãi biển sạch sẽ thì một buổi cắm trại trên biển, đốt lửa quây quần cùng bạn bè và gia đình, tận hưởng gió mát. ngắm hoàng hôn biển đúng là trải nghiệm tuyệt vời trên biển Hồ Cốc. Để thưởng thức được những món hải sản tươi ngon với mức giá phải chăng, bạn có thể mua hải sản ở chợ Bà Rịa Vũng Tàu đóng lạnh và chuẩn bị trước lều sẵn có trước khi đến Hồ Cốc. Biển Hồ Cốc vào tháng 4 đến tháng 8 mỗi năm mát mẻ, sóng biển không quá dịu nhưng cũng không quá mạnh nên rất phù hợp cho các hoạt động vui chơi dưới biển như tận hưởng những giây phút tắm biển mát rượi, nhảy dù biển đầy sảng khoái, tắm nắng biển đầy thư giãn hay nhảy dù biển đầy mạo hiểm và sảng khoái vô tận. Cá mai là loại cá nổi tiếng ở Vũng Tàu. Kích thước cá mai không lớn, thân của nó nhỏ và dài, nhưng lại có hương vị thơm ngon bắt vị, ăn một lần là nhớ mãi. Cá mai thường được rút xương và chế biến thành gỏi, sau đó cuốn chung với bánh tráng rau sống chấm nước mắm tỏi ớt. Địa chỉ: huyện Xuyên Mộc, tỉnh Bà Rịa - Vũng Tàu (cách thành phố du lịch Sài Gòn khoảng 125km về phía Đông Nam, miền Nam, Việt Nam) Phân loại du lịch: du lịch biển, du lịch sinh thái, du lịch kết hợp"
625,Thác Trái Tim,"Tỉnh/thành phố: Phong Thổ, Lai Châu",03/04/2024 02:03:34 AM,https://cdn.alongwalk.info/info/wp-content/uploads/2022/04/08162316/image-du-lich-thac-trai-tim-lai-chau-cach-di-thong-tin-can-biet-luu-y-164938459571419.jpg,"Đúng như tên gọi, thác trái tim là một dòng thác ở xã Sìn Suối Hồ, với bàn tay của mẹ thiên nhiên, dòng thác được chặn lại bởi vách đá, chia thành 2 dòng rồi lại cùng nhau đổ xuống tạo thành hình trái tim ngay giữa rừng núi bạt ngàn. Khung cảnh nên thơ ấy đã chiếm lấy không biết bao nhiêu cảm tình từ du khách gần xa. Bên cạnh đó, theo người dân bản địa, thác trái tim còn gắn liền với truyền thuyết về tình yêu hết sức đẹp đẽ của một đôi nam nữ. Trên con đường ấy, du khách sẽ có những cảm nhận rất riêng, rất thú vị qua mỗi mùa khác nhau. Mùa Xuân, con đường dẫn tới thác trở nên đẹp hơn nhờ vẻ đẹp kiêu hãnh của hoa lan; mùa Hạ, con đường ấy trở nên thơ mộng bởi những bông hoa sim; mùa Thu - mùa thu hoạch thảo quả sẽ khiến du khách cảm thấy thú vị hơn rất nhiều trong chuyến hành trình khám phá mảnh đất này; mùa Đông đến, bước chân du khách như thể dẫm được lên những đám mây. Tất cả như hòa vào nhau tạo thành bức tranh sơn thủy đầy màu sắc. Trên đường lên ngọn thác, dòng chảy tạo thành dòng suối nhỏ đổ theo vách đá, tung bọt trắng xóa như vũ điệu của núi rừng. Ngọn thác còn là minh chứng cho tình yêu đôi lứa trong bản. Mỗi lần bước đến nơi đây, lắng nghe người dân địa phương kể câu chuyện mà họ vẫn lưu truyền về mối tình đẹp giữa đôi trai gái người dân tộc Mông. Địa chỉ: Sìn Suối Hồ, Phong Thổ, Lai Châu (miền Bắc, Việt Nam) Phân loại du lịch: du lịch sinh thái"
1144,Đèo nước ngọt,"Tỉnh/thành phố: Huyện Long Điền và huyện Đất Đỏ, Vũng Tàu",03/04/2024 12:07:28 AM,https://cdn.vntrip.vn/cam-nang/wp-content/uploads/2017/08/deo-nuoc-ngot-2.jpg,"Các bạn có thể tham khảo cung đường sau bằng xe máy: Từ thành phố Hồ Chí Minh di chuyển theo hướng phà Cát Lái đến Nhơn Trạch, gặp quốc lộ 52 thì rẽ phải. Đi thẳng qua cổng chào Bà Rịa đến Long Hải, men theo con đường biển, vượt qua một đoạn đường đèo nhỏ là đến Đèo Nước Ngọt. Cắm trại trên một bãi cát trắng mịn, ngắm nhìn hoàng hôn và bình minh trên biển quả thật là điều không thể bỏ lỡ. Bắt những khoảnh khắc tuyệt đẹp mà thiên nhiên mang lại, cảm nhận những gì yên bình và sảng khoái nhất. Những bữa tiệc nướng BBQ là điều không thể thiếu cho những chuyến du ngoại bên bờ biển. Chỉ cần chuẩn bị than nướng, vỉ nướng, bật lửa, hải sản bạn có thể mua ở chợ Long Hải vì ở đây rất sẵn tôm, cua, cá. Ngoài ra, bạn chuẩn bị sẵn thêm thịt, xúc xích để bữa tiệc nướng ngoài trời được đầy đủ nhất. Tối đến, để hoạt động cắm trại thêm sinh động, các bạn có thể cắm lửa trại. Cùng nhau quây quần bên đám lửa trò chuyện, chơi trò chơi hoặc nhâm nhi chút bia, chút mực nướng. Còn điều gì tuyệt hơn khi có những giây phút gần gũi, chia sẻ cùng đám bạn. Địa chỉ: uốn mình nối hai vùng đất là huyện Long Điền và huyện Đất Đỏ, tỉnh Bà Rịa – Vũng Tàu (cách Vũng Tàu chừng 25km và cách biển Long Hải 2km miền Nam, Việt Nam) Phân loại du lịch: du lịch núi, du lịch sinh thái, du lịch khám phá"
113,Du lịch Hồ Trị An Đồng Nai,"Tỉnh/thành phố: Vĩnh Cửu, Đồng Nai",03/04/2024 12:07:23 AM,https://1phutsaigon.vn/wp-content/uploads/2023/03/hotrian4.jpg,"Hồ Trị An từ lâu đã được biết đến là một địa điểm cắm trại ở Đồng Nai nổi tiếng. Nơi đây vốn thuộc địa phận của thủy điện Trị An, xung quanh được bao phủ bởi những cánh rừng cây bạt ngàn nên cực kì thoáng đãng và mát mẻ. Cắm trại ở hồ Trị An chắc chắn sẽ mang đến cho bạn nhiều trải nghiệm thú vị. Khác với những địa điểm du lịch ở Đồng Nai khác, nơi đây rất tĩnh lặng và bình yên giúp bạn tận hưởng bầu không khí trong lành sau những ngày làm việc mệt mỏi. Vì là một địa điểm cắm trại tự phát nên bạn đừng quên chuẩn bị những món đồ cần thiết để chuyến đi trọn vẹn hơn nhé! Ngoài ra, hồ Trị An cũng rất gần khu du lịch Đảo Ó hay rừng Mã Đà nên bạn có thể kết hợp tham quan nhé! Địa chỉ: huyện Vĩnh Cửu, tỉnh Đồng Nai (miền Nam, Việt Nam) Phân loại du lịch: du lịch kết hợp"
1757,Núi Cao Ly,"Tỉnh/thành phố: Bình Liêu, Quảng Ninh",03/04/2024 12:07:13 AM,https://statics.vinpearl.com/nui-cao-ly-1_1705230176.jpg,"Để đến được núi Cao Ly, bạn có thể đi xe máy hoặc xe hơi. Trên đường lên đến đỉnh núi, bạn sẽ có cơ hội thưởng thức khung cảnh thiên nhiên đẹp mắt với những dãy núi xanh rì, ruộng bậc thang lúa chín rực rỡ. Nếu bạn đam mê leo núi, núi Cao Ly cũng là một lựa chọn phù hợp để thỏa mãn niềm đam mê của mình. Đến núi Cao Ly từ tháng 7 đến cuối tháng 8, bạn sẽ có cơ hội được chiêm ngưỡng sắc tím của hoa mua bung nở trên khắp các vạt đồi. Ngoài ra, bạn cũng có thể hái những trái sim chín mọng, hít hà mùi hương tự nhiên, khoáng đạt của núi rừng, ngắm nhìn đàn bò gặm cỏ. Phóng tầm mắt ra xa, du khách sẽ thấy những cánh đồng của người Dao, người Sán dưới thung lũng mênh mông, xinh đẹp động lòng người. Ngoài ngắm nhìn cảnh quan núi Cao Ly, đến đây bạn cũng có thể cùng bạn bè cắm trại, dã ngoại cực chill, cực thư giãn. Theo đó, bạn nên cắm trại, thưởng thức tiệc ngoài trời ngay dưới chân núi bằng phẳng, rộng thênh thang. Đặc biệt hơn, từ chỗ cắm trại leo lên đỉnh núi Cao Ly cũng chỉ mất khoảng 40 phút. Bạn cùng gia đình hay bạn bè có thể mua các túp lều cắm trại chuyên dụng, mở tiệc nướng đơn giản. Đây chắc chắn sẽ là trải nghiệm khó quên khi tham quan, du lịch tại núi Cao Ly. Địa chỉ: Bình Liêu, Quảng Ninh (miền Bắc, Việt Nam) Phân loại du lịch: du lịch sinh thái, du lịch núi"
461,Cồn Mỹ Phước,Tỉnh/thành phố: Sóc Trăng,03/03/2024 09:13:36 PM,https://media.soctrangtourism.vn/resources/portal//Images/STG/superadminportal.stg/thu_vien_anh/moi_210121/kesach/conmyphuoc/conmyphuocbendongsonghau_924219764.jpg,"Cồn Mỹ Phước với khí hậu trong lành, mát mẻ cây cối xanh tươi, sum suê trĩu quả bốn mùa, phong cảnh nên thơ hữu tình, người dân chất phát, hiền hòa, mến khách… đã trở thành điểm du lịch Sóc Trăng xanh hấp dẫn thu hút đông đảo khách trong và ngoài nước đến tham quan, trải nghiệm và thư giãn. Cồn Mỹ Phước còn được gọi là cồn Công Điền hay cồn Bùn nằm gần cuối hạ lưu, xuôi theo dòng sông Hậu, theo hướng Tây – Bắc, Đông – Nam, ở giữa đôi bờ của 2 tỉnh Sóc Trăng và Trà Vinh, thuộc ấp Mỹ Phước, xã Nhơn Mỹ, huyện Kế Sách, tỉnh Sóc Trăng. Đầu cồn hướng về phía Hậu Giang, Cần Thơ, đuôi cồn hướng ra biển Đông, tiếp giáp với huyện Cù Lao Dung, cách đầu cù lao khoảng 1km, cách bờ biển Đông khoảng 40km, cách trung tâm thành phố Sóc Trăng khoảng 25km. Nếu nhìn từ trên cao xuống, cồn Mỹ Phước có hình bầu dục giống như hình dáng của một chiếc xuồng hay một trái cà na, hai đầu tóp lại, ở giữa phình to ra, chỗ rộng nhất là đoạn cắt ngang qua giữa thân cồn, đường kính khoảng 600m. Cồn Mỹ Phước có chiều dài khoảng 5km, với diện tích tự nhiên hơn 1020 hecta, trong đó diện tích cây ăn trái trên 300 hecta, hiện có 540 hộ gia đình với hơn 1280 cư dân sinh sống. Phân loại du lịch: du lịch sinh thái, du lịch khám phá"
1379,Đầm Ao Châu,"Tỉnh/thành phố: Hạ Hòa, Phú Thọ",03/03/2024 03:35:23 PM,https://alltours.vn/wp-content/uploads/dam-ao-chau-1.jpg,"Đầm Ao Châu là một địa điểm du lịch nổi tiếng ở vùng đất Hạ Hòa, được ví như “Vịnh Hạ Long của Phú Thọ”. Đầm Ao Châu có diện tích mặt nước trên 300 ha với độ sâu trung bình từ 8 đến 10m, chỗ sâu nhất là 15m. Đây là một khu du lịch sinh thái được thiên nhiên ban tặng phong cảnh thiên nhiên phong phú và đa dạng, bao quanh là những quả đồi đất tạo nên bức tranh sơn thủy tuyệt đẹp, tạo nên một cảnh quan rất thơ mộng mà du khách không nên bỏ qua khi đến Phú Thọ. Để thuận lợi cho việc du ngoạn trên hồ ngắm cảnh, săn mây buổi sáng và check-in thì thời tiết đẹp là điều rất quan trọng. Vậy nên, theo kinh nghiệm du lịch đầm Ao Châu được tích lũy từ bao đời thì bạn nên đến đây vào những tháng Phú Thọ ít mưa, thường là từ khoảng tháng 10 đến tháng 02 hằng năm. Khi từ Hà Nội đến, bạn chỉ mất khoảng 150.000 VNĐ cho chi phí di chuyển. Và có thể bạn sẽ không cần tốn tiền thuê khách sạn nếu đi trong ngày. Với chi phí ăn uống thì chỉ trung bình khoảng 50.000 - 100.000 VNĐ/món. Vậy nên khi tính tổng thiệt hại cho chuyến đi Vịnh Hạ Long thu nhỏ này bạn sẽ bất ngờ vì giá rẻ đấy. Một trong những hoạt động chill nhất ở đây là ngồi thuyền dạo quanh hồ và ngắm sông nước tĩnh lặng, mây trời hùng vĩ. Sự kết hợp hài hòa một cách kỳ diệu giữa sơn và thủy đã mang đến một không gian mênh mông, chan hòa và bình yên đến lạ. Địa chỉ: TT. Hạ Hoà, Hạ Hòa, Phú Thọ (miền Bắc, Việt Nam) Phân loại du lịch: du lịch sinh thái"
433,Thác đá Hàn,"Tỉnh/thành phố: Sông Trảng Bom, Đồng Nai",03/03/2024 03:35:13 PM,https://cdn.vntrip.vn/cam-nang/wp-content/uploads/2018/01/anh4.png,"Lại một địa điểm du lịch Đồng Nai tuyệt vời nữa mà du khách không thể bỏ qua trong chuyến đi của mình. Nơi đây hấp dẫn du khách bởi nét yên bình của làng quê, vẻ đẹp bất tận của thiên nhiên nhiệt đới đem đến những cảm giác thư thái, thoải mái cho du khách. Ngoài ra ở đây còn có rất nhiều hoạt động ngoài trời cho cá nhân và tập thể, nếu bạn đang áp lực bởi công việc thì chắc chắn những hoạt động này sẽ là liều thuốc bổ giúp bạn giải tỏa mọi mệt mỏi. Với không gian sinh thái đa dạng, cảnh quan thiên nhiên phong phú thơ mộng cùng các dịch vụ tham quan du lịch hấp dẫn, chi phí đi lại ăn ở thấp, thác Đá Hàn chính là địa điểm ăn chơi nghỉ dưỡng hoàn hảo vào các dịp lễ hay cuối tuần. Địa chỉ: thuộc tổ 15, ấp 5, Sông Trảng Bom, Đồng Nai (miền Nam, Việt Nam) Phân loại du lịch: du lịch kết hợp"
273,Biển Cà Ná,"Tỉnh/thành phố: Thuận Nam, Ninh Thuận",03/03/2024 03:35:08 PM,https://static.vinwonders.com/production/bien-ca-na-2.jpg,"Biển Cà Ná là tên được đặt cho một vùng biển xanh mát thuộc tỉnh Ninh Thuận, Việt Nam. Đã từ lâu bãi biển Cà Ná được coi là “nàng thơ” của miền đất Phan Rang đầy nắng gió. Biển Cà Ná là một trong những vùng biển có vị trí di chuyển khá thuận lợi khi nằm cách thành phố Phan Rang - Tháp Chàm khoảng 32km về hướng Nam. Biển Cà Ná có vị trí nằm ngay cạnh quốc lộ 1A, đường sắt Thống Nhất nên còn được mệnh danh là một trong những cung đường đẹp nhất Việt Nam hiện nay. Theo như kinh nghiệm từ nhiều chuyên gia thì bất kể thời gian nào trong năm cũng đều là thời điểm bạn có thể đi du lịch biển Cà Ná. Tuy nhiên bạn nên tránh lựa chọn đi du lịch vào cuối tháng 5 vì đây là thời điểm mưa nhiều ở miền Nam. Vì vậy rất có thể ảnh hưởng đến chuyến du lịch của bạn. Chi phí để du lịch đến biển Cà Ná còn phụ thuộc vào nhiều yếu tố khác nhau. Tuy nhiên về cơ bản chi phí để đi đến biển Cà Ná sẽ như sau: Nếu như bạn lựa chọn phương pháp du lịch bằng xe khách và tàu hỏa thì chi phí cho vé di chuyển thường sẽ từ 130.000 - 500.000 VNĐ/vé. Tắm biển là một trong những hoạt động không thể thiếu tại biển Cà Ná. Nước biển tại biển Cà Ná có màu trong vắt, những bãi cát vàng trải dài sẽ giúp cho bạn đứng dưới một không gian thơ mộng đánh tan đi những phiền muộn và những ngày làm việc mệt mỏi. Phân loại du lịch: du lịch biển"
1639,Làng hoa Bà Bộ,Tỉnh/thành phố: Cần Thơ,03/03/2024 03:34:37 PM,https://statics.vinpearl.com/lang-hoa-ba-bo-1_1624269826.jpg,"Một điểm du lịch nổi tiếng khác của miền đất Cần Thơ là những cánh đồng hoa trải dài bất tận tại làng hoa Bà Bộ, nơi mà làng nghề trồng hoa được phát triển mạnh mẽ và cung cấp số lượng hoa, cây cảnh lớn cho khu vực Nam Bộ. Làng hoa có 250 hộ trồng hoa, diện tích làng 20 hecta. Tới đây bạn sẽ được chiêm ngưỡng đa dạng loại hoa, là địa điểm phù hợp để check in sống ảo, chụp ảnh vô cùng đẹp mắt. Đây là địa điểm lý tưởng cho những ai đam mê sống ảo. Địa chỉ: phường An Khánh, quận Ninh Kiều, thành phố Cần Thơ Phân loại du lịch: du lịch sinh thái, du lịch khám phá"
1711,Sân chim Chà Là,Tỉnh/thành phố: Cà Mau,03/03/2024 03:34:28 PM,https://media.gody.vn/images/ca-mau/san-chim-cha-vagarden-for-birds/3114c30dac153ece3837816484f916307efe6031.jpg,"Sân chim Chà Là là nơi dự trữ sinh quyển lớn của tỉnh Cà Mau cũng như cả nước. Đối với những ai đam mê du lịch sinh thái thì đây là một địa điểm mà bạn không thể nào bỏ lỡ, với khí hậu ôn hoà cùng thảm thực vật, động vật vô cùng phong phú. Hãy thử trải nghiệm ngay địa điểm thú vị này mà Bách hóa XANH giới thiệu nhé. Phân loại du lịch: du lịch sinh thái"
